{
  "stats": [
    {
      "v": "가나다라마바사아자차카타파하",
      "d": "가나다라마바사아자차카타파하가나다라마바사아자차"
    },
    {
      "v": "가나다라마바사아자차카타파하",
      "d": "가나다라마바사아자차카타파하가나다라마바사아자차"
    },
    {
      "v": "가나다라마바사아자차카타파하",
      "d": "가나다라마바사아자차카타파하가나다라마바사아자차"
    }
  ],
  "title": {
    "pre": "가나다라마바사아자차카타파하",
    "accent": "가나다라마바사아자차카타",
    "post": "가나다라마바사아자차카타파하"
  },
  "subtitle": "가나다라마바사아자차카타파하가나다라마바사아자차카타파하가나",
  "ctas": [
    {
      "text": "가나다라마바사아자차카타파하가나다라",
      "accent": "가나다라마바사아자차"
    },
    {
      "text": "가나다라마바사아자차카타파하가나다라",
      "accent": "가나다라마바사아자차"
    },
    {
      "text": "가나다라마바사아자차카타파하가나다라",
      "accent": "가나다라마바사아자차"
    }
  ],
  "footnote": "가나다라마바사아자차카타파하가나다라마바사아자차카타파하가나다라마바사아자차카타"
}
