{
  "stats": [
    {
      "v": "수 주 → 몇 시간",
      "d": "6~8개 분야 교차 검토를 자동으로"
    },
    {
      "v": "반증 가능한 결론",
      "d": "킬 조건과 검증 실험이 함께 담긴 답"
    },
    {
      "v": "전 과정 기록",
      "d": "발언·반박·소수의견까지 추적 가능"
    }
  ],
  "title": {
    "pre": "HWAX ",
    "accent": "협업진단",
    "post": " 플랫폼"
  },
  "subtitle": "질문을 던지세요 — 전문가 회의가 열립니다.",
  "ctas": [
    {
      "text": "포털 웹 챗 · ",
      "accent": "/심의"
    },
    {
      "text": "개인 Claude 연결 · ",
      "accent": "MCP"
    }
  ],
  "footnote": "모든 심의는 Report Archive와 대화 저장소에 남습니다"
}
